{
  "schema_version": "1.0",
  "status": "passed_with_notes",
  "summary": "課題・既存 tenki-trust 拡張方針・着手順が一致。Open-Meteo 限定とスクレイピング禁止が risk で明示されている。サブタスク 2 はタスク 1 完了後に着手すること。",
  "findings": [
    {
      "severity": "low",
      "category": "goal_alignment",
      "message": "エピックは「複数予報の集約」だが、MVP は数値モデル（Open-Meteo）に限定。民間予報テキストは Won't として要件 1 で固定すること。",
      "subtask_index": 0
    },
    {
      "severity": "low",
      "category": "risk",
      "message": "Geolocation はブラウザ許可が必要。拒否時のフォールバックを仕様 2 で必ず書くこと。",
      "subtask_index": 1
    },
    {
      "severity": "low",
      "category": "task_granularity",
      "message": "サブタスク 5 は任意。未実施でもエピック完了可だが、done_when のスキップ理由を Asana コメントに残すこと。",
      "subtask_index": 4
    }
  ]
}
